file	keywords
BE-KBR00_15463334_19700401_65_00_00_0_01_0048_29151816.txt	PRIX, presse, dépenses, TLZ, ALT, Hil, Supports, RAYMOND, radio, télévision, DUBREUIL, cours, administrateur, Fédération, JOURNAUX, Président, quotidiens, Francaise, fixé, ler
BE-KBR00_15463334_19700401_65_00_00_0_01_0063_29151831.txt	CONSOMMATION, PAPIER-JOURNAL, USA, part, développement, cours, prévisions, ETATS-UNIS, publicité, augmentation, progression, économique, journaux, niveau, ANALYSE, PREVISIONS, américaine, période, dépenses, années
BE-KBR00_15463334_19700401_65_00_00_0_01_0064_29151832.txt	quotidiens, milliards, tirage, PRESSE, Times, QUOTIDIENNE, ANPA, quot, ETATS-UNIS, consommation, nombre, journaux, publicitaires, INDUSTRIE, années, Los, New, Chicago, Tribune, Washington
BE-KBR00_15463334_19700401_65_00_00_0_01_0068_29151836.txt	publicité, pays, enquêtes, PUBLICITE, périodicité, justifier, media, Echo, Presse, Lenormand, schéma, OSER, Chambre, internationale, nationales, comparabilité, publi, annonceurs, citaires, globaux
BE-KBR00_15463334_19700601_66_00_00_0_01_0009_29152150.txt	c'est, général, Walschaerts, directeur, Bragard, Jour, Huybrechts, élégance, Kimpe, Fédération, Gazet, Antwerpen, Jean, montre, confrères, auvre, offrir, L'esprit, qu'ils, viennent
BE-KBR00_15463334_19700601_67_00_00_0_01_0070_29154181.txt	Maître, Fexpérience, UNIGRA, imprimeurs, Imprimeur, patrons, Bruxelles, formation, enseignement, Technique, denn, s’appuyer, aînés, soir, VII, VIII, spécialisé, personnel, devient, difficile
BE-KBR00_15463334_19701201_68_00_00_0_01_0067_29156415.txt	Université, Frans, Theelen, ALLAERT, van, Facult., Hoger, Antwerpen, België, Belgique, Sciences, Luc, Robert, presse, Bibliothèque, bibliotheek, Univ., Rijksuniversiteit, Gent, Dagbladistributie
BE-KBR00_15463334_19701201_68_00_00_0_01_0116_29156464.txt	LLOYD, ANVERSOIS, numéro, Who, MARITIME, Eiermarkt, Antwerpen, JOURNAL, End, Marker, quotidien, belge, Appelez, PRIX, TARIF, PUBLICITE, BUREAU, Document, transports, commerce
BE-KBR00_15463334_19701201_68_00_00_0_01_0117_29156465.txt	Antwerpen, annonces, LLOYD, mercredi, Renseignements, Eiermarkt, ANVERS, ANVERSOIS, page, CHEF, Avis, oui, Telex, Compte, publicité, Banque, remettre, lère, Prix, d'Anvers
BE-KBR00_15463334_19701201_68_00_00_0_01_0133_29156481.txt	BRUXELLES, IMIFI, page, Banque, BOURSE, Renseignements, Houblon, Chronique, publicité, DIR, Informations, Clichés, pages, Louise, rue, Telex, RED, Flandre, ECHO, Couleurs
BE-KBR00_15463334_19701201_68_00_00_0_01_0141_29156489.txt	Bruxelles, annonces, Prix, Renseignements, Sables, SODEPE, Echos, PEUPLE, partir, Rue, Telex, Avis, Noir, Brabant, CHEF, Vantrogh, DIRECT., GER., TVA, page
BE-KBR00_15463334_19701201_68_00_00_0_01_0169_29156517.txt	TRAVAIL, MONDE, Liège, Rue, page, Tél, Annonces, Renseignements, Verviers, Peuple, Avis, couleur, Xhavée, SODEPE, tarif, Groupe, lère, noir, bas, publicité
BE-KBR00_15463334_19701201_68_00_00_0_01_0376_29156724.txt	Nieuws, Het, Jean, Wekelijks, Zondag, Van, Raeymakers, John, Reding, Jeanine, Remy, Raes, Hans, Sansen, Paul, Ons, Land, Spécial, Roger, Soir
BE-KBR00_15463334_19701201_68_00_00_0_01_0387_29156735.txt	Bruxelles, Tél, London, Birmingham, The, ECRITE, GESCHREVEN, Post, PRESSE, PERS, rue, Telegraph, Times, Louise, Sunday, Royale, Daily, avenue, Economic, NABOKOFF
BE-KBR00_15463334_19701201_68_00_00_0_01_0391_29156739.txt	Bruxelles, Tél, York, New, Moscou, News, Général, Lotz, avenue, Tervueren, PRESSE, Domaine, The, Business, rue, ECRITE, GESCHREVEN, PERS, Isvestia, Service
BE-KBR00_15463334_19701201_68_00_00_0_01_0407_29156755.txt	Communautés, Commission, d'information, INFORMATION, Street, Bruxelles, Presse, européennes, rue, Loi, nes, Direction, L'organisation, indéniable, européen, New, York, domaine, l’Information, donné
BE-KBR00_15463334_19701201_68_00_00_0_01_0412_29156760.txt	Publicité, Bruxelles, belge, rue, Gitte, Presse, Chambre, L'Association, Belliard, Bru, Fédération, Conseil, Commission, Privilèges, Publicités, ade, and, rand, sterf, constitution
BE-KBR00_15463334_19701201_68_00_00_0_01_0435_29156783.txt	Directeur, Publicité, Belge, Annonceurs, Internationale, Union, Administrateur-délégué, Associations, Président, L'Union, général, Belgique, Chambre, Commerce, membres, Administrateur, Adverteerders, Belgische, Secrétariat, CORDIER
BE-KBR00_15463334_19701201_68_00_00_0_01_0447_29156795.txt	Bruxelles, Documentatie, Montoyer, Belgisch, Instituut, Voorlichting, rue, directeur, Brussel, Belgique, d'Information, Documentation, Institut, VAN, voor, belge, Président, connaître, Montoyerstraat, mieux
BE-KBR00_15463334_19701201_68_00_00_0_01_0469_29156817.txt	Tél, Bruxelles, Auxiliaire, Commerce, Persknipsels, Presse, Insertions, Paris, rue, Recensement, publicité, manifestations, économiques, s'adresseront, utile, ment, spécialisées, quai, désirent, s’assurer
BE-KBR00_15463334_19711201_72_00_00_0_01_0031_29573794.txt	Université, Bibliothèque, Ignatius, Frans, Theelen, ALLAERT, Hoger, Facult., Sciences, Belgique, van, Robert, presse, Antwerpen, Luc, bibliotheek, Univ., Rijksuniversiteit, Gent, België
BE-KBR00_15463334_19711201_72_00_00_0_01_0052_29573815.txt	Belgique, carré, kilomètre, pays, habitants, population, l'industrie, produits, belge, industrie, petit, prospère, unc, monde, production, détails, d’habitants, fortes, l'agglomération, carrés
BE-KBR00_15463334_19711201_72_00_00_0_01_0088_29573851.txt	LLOYD, ANVERSOIS, numéro, Who, MARITIME, Eiermarkt, Antwerpen, JOURNAL, End, Marker, quotidien, belge, Appelez, Écrivez-nous, PRIX, TARIF, PUBLICITE, BUREAU, Document, transports
BE-KBR00_15463334_19711201_72_00_00_0_01_0089_29573852.txt	annonces, Antwerpen, LLOYD, Renseignements, mercredi, ANVERS, Eiermarkt, ANVERSOIS, page, CHEF, Avis, oui, Télex, publicité, Banque, Compte, lère, remettre, Emballage, Belgian
BE-KBR00_15463334_19711201_72_00_00_0_01_0105_29573868.txt	BRUXELLES, page, Banque, IMIFI, DIR, Renseignements, BOURSE, Houblon, publicité, Chronique, Informations, Soc, Clichés, Telex, Louise, rue, pages, ECHO, Guilmot, Industrielle
BE-KBR00_15463334_19711201_72_00_00_0_01_0113_29573876.txt	Bruxelles, Renseignements, annonces, Sables, PEUPLE, SODEPE, prix, Echos, Rue, Telex, col, Avis, Noir, GROUPE, CHEF, Vantrogh, GER., partir, TVA, DIRECT.
BE-KBR00_15463334_19711201_72_00_00_0_01_0141_29573904.txt	TRAVAIL, MONDE, page, Liège, Annonces, DIRECTEUR, Rue, Avis, Renseignements, Groupe, Peuple, tarif, Tél, couleur, VERVIERS, publicité, lère, SODEPE, bas, rouge
BE-KBR00_15463334_19711201_72_00_00_0_01_0342_29574105.txt	Agence, Europe, Gideon, Hayom, CORRESPONDANTS, Abramowicz, Hans, ETRANGERS, BUITENLANDSE, KORRESPONDENTEN, Eclair, Times, Zeitung, Nord, The, Presse, Die, Pierre, Alfred, Stampa
BE-KBR00_15463334_19711201_72_00_00_0_01_0352_29574115.txt	Bruxelles, Tél, London, The, rue, Paris, Telegraph, Sunday, Daily, Times, Télé, NABOKOFF, Reuters, Birmingham, Errera, RADIO, avenue, Louise, GORDON, Monte-Carlo
BE-KBR00_15463334_19711201_72_00_00_0_01_0356_29574119.txt	Bruxelles, Tél, TCHECHOSLOVAQUIE, Tchécoslovaque, New, Moscou, York, rue, Général, Presse, Agence, Lotz, Prague, Egyptiens, avenue, News, Business, Domaine, SULC, ECRITE
BE-KBR00_15463334_19711201_72_00_00_0_01_0373_29574136.txt	Tél, Télex, Henri, GUILLAUME, Paris, Bruxelles, Paul, PORTE-PAROLE, rue, Street, Genève, York, Washington, Santiago, COMEUR, Chili, Luxembourg, New, Presse, GROUPE
BE-KBR00_15463334_19711201_72_00_00_0_01_0378_29574141.txt	Publicité, Bruxelles, belge, rue, Presse, Chambre, Belliard, L'Association, Bru, Fédération, Editeurs, Privilèges, Commission, Publicités, Annonceurs, Conseil, constitution, contact, bonnes, relations
BE-KBR00_15463334_19711201_72_00_00_0_01_0403_29574166.txt	Directeur, Belge, Publicité, Internationale, Administrateur-délégué, Annonceurs, l'Union, Associations, Chambre, Commerce, membres, Administrateur, Président, général, ’Union, Benelux, Belgique, Adverteerders, Belgische, Secrétariat
BE-KBR00_15463334_19711201_72_00_00_0_01_0415_29574178.txt	Bruxelles, Documentatie, Montoyer, Belgisch, Instituut, Voorlichting, rue, Brussel, conseiller, Belgique, Documentation, Institut, VAN, d’Information, voor, Ministère, belge, Président, connaître, Montoyerstraat
BE-KBR00_15463334_19711201_72_00_00_0_01_0438_29574201.txt	Auxiliaire, Commerce, Tél, Presse, Persknipsels, Bruxelles, Insertions, Paris, etc., rue, Recensement, publicité, manifestations, économiques, s'adresseront, utile, ment, spécialisées, quai, désirent
BE-KBR00_15463334_19720301_73_00_00_0_01_0024_29572269.txt	van, het, Die, Belgique, Belgische, bijstand, pays, een, belges, land, professeurs, zij, voor, Congo, Burundi, l'assistance, Ruanda, Tiers-monde, niet, alleen
BE-KBR00_15463334_19730801_79_00_00_0_01_0018_29577910.txt	Presse, Diffu, Moyens, Communication, Journaux, Belgique, initiative, Belge, belges, sion, journal, économie, commerce, Stand, année, Somville, Gazet, Antwer, l'occasion, Prix
BE-KBR00_15463334_19740501_82_00_00_0_01_0052_29578562.txt	van, Presse, New, York, CONCURRENCE, Atout, feuille, conflit, GRATUITE, zal, publicitaire, déloyale, directeur, opposant, union, terme, réli, mination, corporation, effectifs
BE-KBR00_15463334_19741001_84_00_00_0_01_0052_29581021.txt	tribunal, GRANDE, DIFFICULTES, FRANCAISE, société, presse, Paris, EDITIONS, commerce, SMAELE, ALBERT, octobre, Néogravure, connaît, groupe, actuellement, sérieuses, d'exploitation, conduit, IMPRIMERIE
BE-KBR00_15463334_19750401_86_00_00_0_01_0032_29581274.txt	Sabena, d'affaires, Business, OBCE, hommes, Office, Extérieur, Bruxelles, Commerce, Belge, National, club, compagnie, d'un, salon, l'aéroport, belges, Card, Ouverture, avril
BE-KBR00_15463334_19750401_86_00_00_0_01_0034_29581276.txt	van, MERCURE, het, Persoverzicht, BANGLA, DESJ, Bangladesj, een, SOIR, Presse, heeft, Nederland, Twee, met, PRIX, d’Or, TIJD, INTERNATIONAL, BIJLAGE, Journal
BE-KBR00_15463334_19750701_87_00_00_0_01_0016_29581539.txt	Fondation, programme, d'aide, journaux, presse, ALLEMAGNE, millions, Bonn, gouvernement, éco, nomique, lancent, vient, d’arrêter, finances, montant, suivantes, éditeurs, représentants, fédéral
BE-KBR00_15463334_19750701_87_00_00_0_01_0020_29581543.txt	loi, presse, comité, tiques, parlementaires, d’ailleurs, pré, voyait, poli, Etat, mesures, approuvée, fractions, raison, allocations, temps, subvention, secrétariats, partis, SUISSE
BE-KBR00_15463334_19750701_87_00_00_0_01_0059_29581582.txt	van, PUBLICITAIRE, publicité, L'INDICATEUR, L'édition, Bibliografie, het, een, media, Belgique, pers, vient, gaat, Buitenlandse, Bibliographie, lisibilité, davantage, paraître, format, habile
BE-KBR00_15463334_19751001_88_00_00_0_01_0024_29583741.txt	publicité, titre, Belge, CONSEIL, Chambre, PUBLICITE, Editeurs, Fédération, l'Union, Presse, l'Association, Belges, associations, membres, Annonceurs, Publicités, groupement, per, sonnes, d'annonceur
BE-KBR00_15463334_19751001_88_00_00_0_01_0026_29583743.txt	jury, publicité, d'une, cas, code, organisation, membres, lois, d’éthique, d'un, légiférer, n’était, nécessaire, codes, moyens, disposions, fallait, avions, règles, c'est
BE-KBR00_15463334_19761201_92_00_00_0_01_0043_29586644.txt	diplômes, SERVICE, EXTRAIT, Fonction, Arrêté, Article, présent, BAUDOUIN, octobre, d'Etat, publique, BELGE, Belges, portant, Roi, MONITEUR, ler, l'annexe, statut, agents
BE-KBR00_15463334_19780501_97_00_00_0_01_0025_29590869.txt	publicité, annonceurs, éditeurs, Grâce, fut, journaux, agences, création, Conseil, l'annonceur, étape, presse, publicitaire, tarifs, l'OFADI, constitution, diffusion, d'une, connaître
BE-KBR00_15463334_19780501_97_00_00_0_01_0047_29590891.txt	Nijverheid, Handel, Industrie, Commerce, Hommes, LAD, Vrouwen, Femmes, Source, gains, travailleurs, Sociale, Handarbeiders, Mannen, 25:225, 6:155, Evolutie, Zekerheid, Evolution, Sécurité
BE-KBR00_15463334_19780501_97_00_00_0_01_0050_29590894.txt	Gent, Rijksuniversiteit, Pers, Hoger, van, Communicatiewetenschap, Instituut, voor, COOLSAET, Dirk, Marc, Belgiën, Antwerpen, Institut, Hautes, commerciales, communicatiewetenschappen, Université, presse, Belgische
BE-KBR00_15463334_19780501_97_00_00_0_01_0078_29590922.txt	Presse, Internationale, van, Pers, Vereniging, Press, membres, Journal, Agence, Siège, Maison, Center, Pré, Association, Buitenlandse, Boulevard, Bruxelles, Tél, Charlemagne, Européens
BE-KBR00_15463334_19780501_97_00_00_0_01_0128_29590972.txt	LLOYD, voor, ANVERSOIS, het, Eiermarkt, Belgische, ANTWERPSE, dagblad, Antwerpen, transportwezen, handel, dat, van, internationale, industrie, financies, enige, zijn, totale, oplage
BE-KBR00_15463334_19780501_97_00_00_0_01_0336_29591180.txt	Bruxelles, Tél, rue, Lotz, New, York, Général, Moscou, URUGUAY, Corr, PRESSE, Domaine, News, ECRITE, GESCHREVEN, PERS, Service, Pais, Montevideo, AGENTSCHAPPEN
BE-KBR00_15463334_19780501_97_00_00_0_01_0349_29591193.txt	Bruxelles, Publicité, belge, Rue, Conseil, Chambre, Bte, Belliard, L'Association, Editeurs, Fédération, Tél, Presse, Commission, Colonies, Publicités, Annonceurs, Président, contact, bonnes
BE-KBR00_15463334_19780501_97_00_00_0_01_0352_29591196.txt	publicité, Jury, Code, Commission, médicaments, Publicitaire, Comités, cosmétiques, Comité, d'Ethique, codes, Conseil, veiller, produits, d'Hygiène, publicités, l'autodiscipline, lors, JEP, Bruxelles
BE-KBR00_15463334_19780501_97_00_00_0_01_0362_29591206.txt	Belge, Directeur, Publicité, Annonceurs, L'Union, Président, Administrateur-Délégué, Internationale, Administrateur, Chambre, Commerce, général, Associations, Adverteerders, Belgische, Advertising, Benelux, CORDIER, Directeur-général, Georges
BE-KBR00_15463334_19801201_107_00_00_0_01_0032_29679454.txt	Dublin, The, Commun, Commit, newspaper, Ireland, Marché, van, Managers’, James, Vink, tee, Frans, mai, communauté, s'est, Voorzitter, industry, d'associations, d'éditeurs
BE-KBR00_15463334_19810601_108_00_00_0_01_0004_29681644.txt	Nationale, hebdomadaires, Assocation, Hebdoma, Journaux, Fédération, septembre, anniversaire, d'Information, volontiers, l'interprète, congratuler, daires, l'occasion, Belge, Editeurs, succès, Président, création, rôle
BE-KBR00_15463334_19810601_108_00_00_0_01_0117_29681757.txt	MEUSE, Philippeville, Evrard, Courrier, Charles, région, Naissance, HEBDOMADAIRE, d'une, Caisse, Namur, ans, Fédération, Charleroi, août, fonder, rel, naissait, catholique, devait
BE-KBR00_15463334_19820101_109_00_00_0_01_0054_29683340.txt	annonces, Chambre, l'ensemble, d'environ, Publicité, commerciales, Belgique, publicitaires, media, investissements, chiffre, s'agit, directe, statistique, établie, Agences-Conseils, compter, concours, associations, Internationale
BE-KBR00_15463334_19820101_109_00_00_0_01_0064_29683350.txt	Gent, Rijksuniversiteit, Pers, hoger, van, instituut, Communicatiewetenschap, voor, CONINX, Tonny, Algemeen, Limburg, Marc, Antwerpen, communicatiewetenschappen, Het, België, licentie, Universiteit, relations
BE-KBR00_15463334_19820101_109_00_00_0_01_0066_29683352.txt	Université, presse, Jean, Hoger, Pers, Universiteit, voor, Instituut, Louvain, Catholique, Katholieke, Leuven, GENESSE, van, Antwerpen, Sociale, Appliquées, Economiques, Gent, Handel
BE-KBR00_15463334_19820101_109_00_00_0_01_0069_29683355.txt	van, Universiteit, Leuven, pers, Gent, Vlaamse, licentie, Katholieke, SARLEE, Willy, Vrije, communicatiewetenschappen, Amada, presse, Rijksuniversiteit, Het, Université, Een, Journalisme, België
BE-KBR00_15463334_19820101_109_00_00_0_01_0096_29683382.txt	Presse, Internationale, van, Pers, Vereniging, Agence, Press, The, membres, Siège, Maison, Center, Europe, Association, Buitenlandse, Boulevard, Bruxelles, Tél, Charlemagne, Européens
BE-KBR00_15463334_19820101_109_00_00_0_01_0142_29683428.txt	REPLI, STOCKHOLM, Lef, QUOTIDIEN, MARITIME, TRANSPORTS, COMMERCE, INDUSTRIE, FINANCES, ITALIEN, CADRE, DUNE, JOURNEE, PROMOTION, SATISFAIT, ANVERSOIS, LAMBER, sns, D'INFORMATION, Zeebrugge
BE-KBR00_15463334_19820101_109_00_00_0_01_0143_29683429.txt	Lloyd, partir, Anversois, ANTWERPEN, annonces, Eiermarkt, DIRECTEUR, date, Renseignements, Banque, Prix, Télex, oui, jours, Jaumotte, ouvrables, Supplément, couleurs, d'insertion, Classe
BE-KBR00_15463334_19820101_109_00_00_0_01_0234_29683520.txt	Tél., Bruxelles, Presse, Persknipsels, Commerce, Paris, Insertions, Recensement, cité, manifestations, Auxiliaire, quai, désirent, s'assurer, l'importance, nature, d'annonces, publ, comptes, rendus
BE-KBR00_15463334_19820101_109_00_00_0_01_0239_29683525.txt	CHARLEROI, Hoofdred, Dir, Réd, Tél, Commerce, METROPOLITAIN, Direction, chef, GENT, LANOYE, VAN, Dir., COURRIER, OOSTENDE, HET, DENDERMONDE, Romain, Robert, Monique
BE-KBR00_15463334_19820101_109_00_00_0_01_0298_29683584.txt	Ela, fideles, annonceurs, avertis, région, metro, CHARLEROI, Tél, OOO, CENTRE, EUROPE, Coin, Commerce, Bte, Post, POLITAIN, MÉTRO, End, Marker, Buisset
BE-KBR00_15463334_19820101_109_00_00_0_01_0299_29683585.txt	col, REDACT, Métropolitain, CHARLEROI, Renseignements, rue, Tél., Rubrique, Hasquin, DIRECTION, Commerce, CHEF, ADMINISTRATION, page, Pages, Hebdomadaire, REDACTION, SECRETAIRE, rubriques, Tarif
BE-KBR00_15463334_19820101_109_00_00_0_01_0362_29683648.txt	Bruxelles, Tél, rue, New, York, Louisville, ALTSCHULL, Ortelius, Herbert, News, Bureaux, Service, bte, The, Journal, Magazine, Charles, Press, Courier, Photographe
BE-KBR00_15463334_19820101_109_00_00_0_01_0377_29683663.txt	Bruxelles, Publicité, Bte, belge, Rue, Conseil, ASBL, Editeurs, Chambre, L'Association, Colonies, Belliard, Union, Commission, Presse, Tél, Publicités, avenue, Président, Annonceurs
BE-KBR00_15463334_19820101_109_00_00_0_01_0393_29683679.txt	Directeur, Publicité, Belge, Administrateur, Annonceurs, JOO, Président, VAN, Internationale, Union, Beheerder, Benelux, Général, Chambre, Commerce, L'Union, Associations, Délégué, Adverteerders, Belgische
BE-KBR00_15463334_19820101_110_00_00_0_01_0039_29682328.txt	COMMISSION, LORRAIN, ANTIOPE, NICE-MATIN, presse, groupe, EXPERIMENTATION, REPUBLICAIN, SYSTEME, Communication, l'introduction, Parlement, ministre, NATIONALE, quotidiens, journal, dérogations, LONRHO, télématique, Fillioud
BE-KBR00_15463334_19820601_111_00_00_0_01_0030_29684273.txt	journaux, Digest, Sélection, Reader, Publicité, QUOTIDIENS, Quotidien, Finlande, finlandais, Humanité, Presse, semaine, PUBLICITAIRES, millions, l'Etat, Brandolini, prix, d'Adda, directeur, relations
BE-KBR00_15463334_19821101_113_00_00_0_01_0026_29686157.txt	annonces, Publicité, Chambre, l'ensemble, Belgique, commerciales, publicitaires, media, investissements, chiffre, s'agit, directe, Internationale, Brochure, CCI, statistique, établie, Agences-Conseils, compter, concours
BE-KBR00_15463334_19821101_113_00_00_0_01_0036_29686167.txt	Gent, Rijksuniversiteit, Hoger, Instituut, van, Pers, België, Antwerpen, voor, krant, communicatiewetenschappen, Een, CRIEL, Theo, Marc, Communicatiewetenschap, Universiteit, licentie, Institut, Hautes
BE-KBR00_15463334_19821101_113_00_00_0_01_0037_29686168.txt	van, pers, een, Instituut, Hoger, Antwerpen, Universiteit, het, Gent, DEPLOIGE, communicatiewetenschappen, voor, Rijksuniversiteit, Leuven, departement, Sociale, Katholieke, Handel, Université, licentie
BE-KBR00_15463334_19821101_113_00_00_0_01_0038_29686169.txt	Université, Hoger, presse, Instituut, voor, Jean, Pers, Louvain, Catholique, Universiteit, Antwerpen, van, Handel, Katholieke, Leuven, Het, FRICKEL, Nancy, Provinciaal, PIVA
BE-KBR00_15463334_19821101_113_00_00_0_01_0042_29686173.txt	van, Gent, Het, Rijksuniversiteit, Hoger, Antwerpen, pers, Instituut, DEN, Universiteit, TYRIONS, Leuven, voor, Katholieke, Vlaamse, licentie, Economische, een, België, DAELE
BE-KBR00_15463334_19821101_113_00_00_0_01_0070_29686201.txt	Presse, Internationale, van, Pers, Agence, Vereniging, membres, Press, The, Centrale, Association, Buitenlandse, Siège, Maison, Center, Boulevard, Bruxelles, Tél, Charlemagne, Président
BE-KBR00_15463334_19821101_113_00_00_0_01_0113_29686244.txt	Lloyd, partir, Anversois, ANTWERPEN, annonces, Eiermarkt, Renseignements, DIRECTEUR, CHEF, Tél, Télex, col, Prix, Classe, date, Jaumotte, couleurs, Supplément, REDACTION, Anvers
BE-KBR00_15463334_19821101_113_00_00_0_01_0206_29686337.txt	Bruxelles, Persknipsels, Presse, Tél, Commerce, Paris, Insertions, Telex, Recensement, publicité, manifestations, quai, Auxipress, Tél., Eglises, désirent, s’assurer, limportance, nature, d'annonces
BE-KBR00_15463334_19821101_113_00_00_0_01_0211_29686342.txt	BRUGGE, Réd, LOCALITES, ANDERE, Eekhoutstraat, Zaakvoerders, chef, Hoofdred., PLAATSEN, BRUGSCH, HANDELSBLAD, Tel., GENT, Dir., LANOYE, Dir, VAN, Tél, COURRIER, Telex
BE-KBR00_15463334_19821101_113_00_00_0_01_0276_29686407.txt	hebd, metro, CHARLEROI, Tél, POLITAIN, MÉTRO, CENTRE, EUROPE, Coin, Commerce, Bte, Post, habitants, End, Marker, fidèles, Buisset, Collège, Rue, Ville-Basse
BE-KBR00_15463334_19821101_113_00_00_0_01_0277_29686408.txt	REDACT, Métropolitain, CHARLEROI, Renseignements, Tél, col, Hasquin, DIRECTION, rue, Commerce, Nivelles, CHEF, ADMINISTRATION, page, Pages, Hebdomadaire, REDACTION, SECRETAIRE, Tarif, Gén
BE-KBR00_15463334_19821101_113_00_00_0_01_0341_29686472.txt	Bruxelles, Tél, rue, York, New, Business, Bureaux, Tlx, Chée, Robert, Avenue, News, Week, Magazine, Namur, Wavre, Galerie, Service, Porte, Dezangré
BE-KBR00_15463334_19821101_113_00_00_0_01_0357_29686488.txt	Publicité, Bruxelles, Bte, belge, Conseil, Rue, ASBL, Editeurs, Chambre, Colonies, avenue, Belliard, Tél, Presse, Commission, Publicités, Union, Président, Annonceurs, contact
BE-KBR00_15463334_19821101_113_00_00_0_01_0362_29686493.txt	publicité, Conseil, Jury, COMMUNICATION, Belluco, Bruyne, Economiques, Politiques, Belgique, Professeur, Paul, Doyen, Faculté, Sciences, Sociales, Monsieur, Denolin, part, Chambre, Commerce
BE-KBR00_15463334_19821101_113_00_00_0_01_0369_29686500.txt	van, Internationale, Adverteerders, jen, Belge, Publicité, Unie, der, Annonceurs, Belgische, Jio, Sch, Jus, Administrateur, Délégué, Beheerder, Directeur, Union, Reclame, Chambre
BE-KBR00_15463334_19821101_113_00_00_0_01_0379_29686510.txt	PAPIER, TRANSFORMATRICES, FEDERATION, INDUSTRIES, Waterloo, Conseil, Raadgever, Bruxelles, Brussel, CARTON, Conseiller, Questions, Voorzitter, Bedrijfsraad, Président, COESSENS, Professionnel, van, THERY, Fet
BE-KBR00_15463334_19830801_115_00_00_0_01_0011_29685209.txt	Mediatel, service, memento, presse, professionnelles, coordonnées, politiques, nom, adresse, télé, phone, internationales, politigue, contient, principalement, instances, fonctions, hommes, commerce, belges
BE-KBR00_15463334_19830801_115_00_00_0_01_0036_29685234.txt	contrat, Presse, Publicité, Cour, PHOTOGRAPHE, travail, CLIENTÈLE, arrêt, CRÉATION, cas, indemnité, droit, L'Echo, publier, qu'il, d'Appel, décision, clichés, usage, usages
BE-KBR00_15463334_19840201_117_00_00_0_01_0026_29689111.txt	Chambre, Publicité, annonces, l'ensemble, Belgique, publicitaires, media, commerciales, investissements, chiffre, s'agit, directe, statistique, établie, Agences-Conseils, compter, concours, associations, Internationale, Brochure
BE-KBR00_15463334_19840201_117_00_00_0_01_0036_29689121.txt	Gent, Rijksuniversiteit, van, Pers, instituut, hoger, communicatiewetenschappen, voor, Communicatiewetenschap, Ignace, België, BEELDE, Advertentiepers, Marc, Antwerpen, Universiteit, licentie, Een, Katholieke, Leuven
BE-KBR00_15463334_19840201_117_00_00_0_01_0037_29689122.txt	Hoger, Instituut, Antwerpen, een, van, Het, pers, Universiteit, voor, Kwik’, Katholieke, Ingrid, communicatiewetenschappen, Université, Belgische, toegepaste, Provinciaal, presse, Handel, sociale
BE-KBR00_15463334_19840201_117_00_00_0_01_0041_29689126.txt	van, Universiteit, Leuven, Gent, Pers, het, Katholieke, Antwerpen, DEN, Communicatiewetenschappen, SMEETS, Cor, Reklamebureau, België, Media, Planning, Rijksuniversiteit, Presse, Hoger, Wetenschappen
BE-KBR00_15463334_19840201_117_00_00_0_01_0066_29689151.txt	Presse, Internationale, van, Pers, The, Press, Président, Vereniging, Agence, membres, Europe, Association, Siège, Maison, Center, L'Association, Boulevard, Bruxelles, Tél, Charlemagne
BE-KBR00_15463334_19840201_117_00_00_0_01_0109_29689194.txt	Lloyd, partir, ANTWERPEN, Anversois, annonces, Eiermarkt, Renseignements, DIRECTEUR, CHEF, Tél, Télex, Prix, col, Jaumotte, REDACTEURS, Anvers, Supplément, couleurs, Rubrique, Bossche
BE-KBR00_15463334_19840201_117_00_00_0_01_0329_29689414.txt	Bruxelles, Tél, rue, DROBKOV, Vladislav, New, York, Moscou, Bte, Tlx, avenue, Journal, Bureaux, Peter, John, News, Uccle, Agence, Chée, Wavre
BE-KBR00_15463334_19840201_117_00_00_0_01_0345_29689430.txt	Bruxelles, Publicité, Bte, belge, Rue, Conseil, ASBL, Editeurs, Chambre, Colonies, avenue, Belliard, Commission, Union, Presse, Président, Publicités, Tél, Annonceurs, contact
BE-KBR00_15463334_19840201_117_00_00_0_01_0350_29689435.txt	publicité, Conseil, dossiers, Jury, annonceur, collaboration, Kete, Code, Produits, Cosmétiques, Commission, travaux, examen, matière, Correspondance, Advertising, réunion, problèmes, Groupement, Vente
BE-KBR00_15463334_19840201_117_00_00_0_01_0357_29689442.txt	van, Internationale, Adverteerders, Belge, Publicité, Unie, der, Annonceurs, Belgische, Administrateur, Délégué, l'Union, Directeur, Reclame, Président, membres, Chambre, Commerce, Associations, Kamer
BE-KBR00_15463334_19840201_117_00_00_0_01_0367_29689452.txt	PAPIER, TRANSFORMATRICES, FEDERATION, INDUSTRIES, van, Conseil, Waterloo, papiers, CARTON, Bruxelles, Raadgever, Brussel, Conseiller, Questions, Voorzitter, Philippe, Bedrijfsraad, Président, karton, Professionnel
